chapter_id,verse_number,verse_key,arabic_text,arabic_text_raw,turkish_text
1,1,1:1,بسم الله الرحمن الرحيم,بِسْمِ ٱللَّهِ ٱلرَّحْمَـٰنِ ٱلرَّحِيمِ,Rahman ve Rahim olan Allah'ın adıyla:
1,2,1:2,الحمد لله رب العلمين,ٱلْحَمْدُ لِلَّهِ رَبِّ ٱلْعَـٰلَمِينَ,"Hamd, Alemlerin Rabbi Allah'a mahsustur."
1,3,1:3,الرحمن الرحيم,ٱلرَّحْمَـٰنِ ٱلرَّحِيمِ,"O Rahman ve Rahim'dir,"
1,4,1:4,ملك يوم الدين,مَـٰلِكِ يَوْمِ ٱلدِّينِ,Din Gününün sahibidir.
1,5,1:5,اياك نعبد واياك نستعين,إِيَّاكَ نَعْبُدُ وَإِيَّاكَ نَسْتَعِينُ,Ancak Sana kulluk eder ve yalnız Senden yardım dileriz.
1,6,1:6,اهدنا الصرط المستقيم,ٱهْدِنَا ٱلصِّرَٰطَ ٱلْمُسْتَقِيمَ,Bizi doğru yola eriştir.
1,7,1:7,صرط الذين انعمت عليهم غير المغضوب عليهم ولا الضالين,صِرَٰطَ ٱلَّذِينَ أَنْعَمْتَ عَلَيْهِمْ غَيْرِ ٱلْمَغْضُوبِ عَلَيْهِمْ وَلَا ٱلضَّآلِّينَ,"Nimete erdirdiğin kimselerin yoluna; gazaba uğrayanların, ya da sapıtanların yoluna değil."
2,1,2:1, الم, الٓمٓ,"Elif, Lam, Mim."
2,2,2:2,ذلك الكتب لا ريب ۛ فيه ۛ هدى للمتقين,ذَٰلِكَ ٱلْكِتَـٰبُ لَا رَيْبَ ۛ فِيهِ ۛ هُدًى لِّلْمُتَّقِينَ,"Bu, doğruluğu şüphe götürmeyen ve Allah'a karşı gelmekten sakınanlara yol gösteren Kitap'dır."
2,3,2:3,الذين يومنون بالغيب ويقيمون الصلوة ومما رزقنهم ينفقون,ٱلَّذِينَ يُؤْمِنُونَ بِٱلْغَيْبِ وَيُقِيمُونَ ٱلصَّلَوٰةَ وَمِمَّا رَزَقْنَـٰهُمْ يُنفِقُونَ,"Onlar, gaybe inanırlar, namazı kılarlar, kendilerine verdiğimiz rızıktan yerli yerince sarfederler."
2,4,2:4,والذين يومنون بما انزل اليك وما انزل من قبلك وبالاخرة هم يوقنون,وَٱلَّذِينَ يُؤْمِنُونَ بِمَآ أُنزِلَ إِلَيْكَ وَمَآ أُنزِلَ مِن قَبْلِكَ وَبِٱلْـَٔاخِرَةِ هُمْ يُوقِنُونَ,"Onlar, sana indirilen Kitap'a da, senden önce indirilenlere de inanırlar; ahirete de yalnız onlar kesinlikle inanırlar."
2,5,2:5,او۟ليك على هدى من ربهم ۖ واو۟ليك هم المفلحون,أُو۟لَـٰٓئِكَ عَلَىٰ هُدًى مِّن رَّبِّهِمْ ۖ وَأُو۟لَـٰٓئِكَ هُمُ ٱلْمُفْلِحُونَ,İşte Rab'lerinin yolunda olanlar ve saadete erişenler bunlardır.
2,6,2:6,ان الذين كفروا۟ سواء عليهم ءانذرتهم ام لم تنذرهم لا يومنون,إِنَّ ٱلَّذِينَ كَفَرُوا۟ سَوَآءٌ عَلَيْهِمْ ءَأَنذَرْتَهُمْ أَمْ لَمْ تُنذِرْهُمْ لَا يُؤْمِنُونَ,"Şüphe yok ki, inkar edenleri, başlarına gelecekle uyarsan da uyarmasan da birdir, inanmazlar."
2,7,2:7,ختم الله على قلوبهم وعلى سمعهم ۖ وعلى ابصرهم غشوة ۖ ولهم عذاب عظيم,خَتَمَ ٱللَّهُ عَلَىٰ قُلُوبِهِمْ وَعَلَىٰ سَمْعِهِمْ ۖ وَعَلَىٰٓ أَبْصَـٰرِهِمْ غِشَـٰوَةٌ ۖ وَلَهُمْ عَذَابٌ عَظِيمٌ,"Allah onların kalblerini ve kulaklarını mühürlemiştir, gözlerinde de perde vardır ve büyük azab onlar içindir."
2,8,2:8,ومن الناس من يقول ءامنا بالله وباليوم الاخر وما هم بمومنين,وَمِنَ ٱلنَّاسِ مَن يَقُولُ ءَامَنَّا بِٱللَّهِ وَبِٱلْيَوْمِ ٱلْـَٔاخِرِ وَمَا هُم بِمُؤْمِنِينَ,"İnsanlardan, inanmadıkları halde, &quot;Allah'a ve ahiret gününe inandık&quot; diyenler vardır."
2,9,2:9,يخدعون الله والذين ءامنوا۟ وما يخدعون الا انفسهم وما يشعرون,يُخَـٰدِعُونَ ٱللَّهَ وَٱلَّذِينَ ءَامَنُوا۟ وَمَا يَخْدَعُونَ إِلَّآ أَنفُسَهُمْ وَمَا يَشْعُرُونَ,"Bunlar Allah'ı ve inananları aldatmaya çalışırlar, oysa sadece kendilerini aldatırlar da farkında değildirler."
2,10,2:10,فى قلوبهم مرض فزادهم الله مرضا ۖ ولهم عذاب اليمۢ بما كانوا۟ يكذبون,فِى قُلُوبِهِم مَّرَضٌ فَزَادَهُمُ ٱللَّهُ مَرَضًا ۖ وَلَهُمْ عَذَابٌ أَلِيمٌۢ بِمَا كَانُوا۟ يَكْذِبُونَ,"Kalblerinde hastalık vardır, Allah hastalıklarını artırmıştır. Yalan söyleye geldikleri için onlara elem verici azab vardır."
3,1,3:1, الم, الٓمٓ,"Elif, Lam, Mim."
3,2,3:2,الله لا اله الا هو الحى القيوم,ٱللَّهُ لَآ إِلَـٰهَ إِلَّا هُوَ ٱلْحَىُّ ٱلْقَيُّومُ,"Allah, Ondan başka tanrı olmayan, diri, her an yaratıklarını gözetip durandır."
3,3,3:3,نزل عليك الكتب بالحق مصدقا لما بين يديه وانزل التورىة والانجيل,نَزَّلَ عَلَيْكَ ٱلْكِتَـٰبَ بِٱلْحَقِّ مُصَدِّقًا لِّمَا بَيْنَ يَدَيْهِ وَأَنزَلَ ٱلتَّوْرَىٰةَ وَٱلْإِنجِيلَ,"Kendisinden önceki Kitapları tasdik eden Hak Kitap'ı sana indirdi. Önceden insanlara yol gösterici olarak Tevrat ve İncil'i de indirmişti. O, doğruyu yanlıştan ayıran Kitap'ı indirdi. Doğrusu Allah'ın ayetlerini inkar edenler için şiddetli azab vardır. Allah güçlüdür, mazlumların öcünü alır."
3,4,3:4,من قبل هدى للناس وانزل الفرقان ۗ ان الذين كفروا۟ بايت الله لهم عذاب شديد ۗ والله عزيز ذو انتقام,مِن قَبْلُ هُدًى لِّلنَّاسِ وَأَنزَلَ ٱلْفُرْقَانَ ۗ إِنَّ ٱلَّذِينَ كَفَرُوا۟ بِـَٔايَـٰتِ ٱللَّهِ لَهُمْ عَذَابٌ شَدِيدٌ ۗ وَٱللَّهُ عَزِيزٌ ذُو ٱنتِقَامٍ,"Kendisinden önceki Kitapları tasdik eden Hak Kitap'ı sana indirdi. Önceden insanlara yol gösterici olarak Tevrat ve İncil'i de indirmişti. O, doğruyu yanlıştan ayıran Kitap'ı indirdi. Doğrusu Allah'ın ayetlerini inkar edenler için şiddetli azab vardır. Allah güçlüdür, mazlumların öcünü alır."
3,5,3:5,ان الله لا يخفى عليه شىء فى الارض ولا فى السماء,إِنَّ ٱللَّهَ لَا يَخْفَىٰ عَلَيْهِ شَىْءٌ فِى ٱلْأَرْضِ وَلَا فِى ٱلسَّمَآءِ,Şüphesiz gökte ve yerde hiçbir şey Allah'tan gizli kalmaz.
3,6,3:6,هو الذى يصوركم فى الارحام كيف يشاء ۚ لا اله الا هو العزيز الحكيم,هُوَ ٱلَّذِى يُصَوِّرُكُمْ فِى ٱلْأَرْحَامِ كَيْفَ يَشَآءُ ۚ لَآ إِلَـٰهَ إِلَّا هُوَ ٱلْعَزِيزُ ٱلْحَكِيمُ,"Ana rahminde sizi dilediği gibi şekillendiren O'dur. O'ndan başka tanrı yoktur, güçlüdür, Hakim'dir."
3,7,3:7,هو الذى انزل عليك الكتب منه ءايت محكمت هن ام الكتب واخر متشبهت ۖ فاما الذين فى قلوبهم زيغ فيتبعون ما تشبه منه ابتغاء الفتنة وابتغاء تاويلهۦ ۗ وما يعلم تاويلهۥ الا الله ۗ والرسخون فى العلم يقولون ءامنا بهۦ كل من عند ربنا ۗ وما يذكر الا او۟لوا۟ الالبب,هُوَ ٱلَّذِىٓ أَنزَلَ عَلَيْكَ ٱلْكِتَـٰبَ مِنْهُ ءَايَـٰتٌ مُّحْكَمَـٰتٌ هُنَّ أُمُّ ٱلْكِتَـٰبِ وَأُخَرُ مُتَشَـٰبِهَـٰتٌ ۖ فَأَمَّا ٱلَّذِينَ فِى قُلُوبِهِمْ زَيْغٌ فَيَتَّبِعُونَ مَا تَشَـٰبَهَ مِنْهُ ٱبْتِغَآءَ ٱلْفِتْنَةِ وَٱبْتِغَآءَ تَأْوِيلِهِۦ ۗ وَمَا يَعْلَمُ تَأْوِيلَهُۥٓ إِلَّا ٱللَّهُ ۗ وَٱلرَّٰسِخُونَ فِى ٱلْعِلْمِ يَقُولُونَ ءَامَنَّا بِهِۦ كُلٌّ مِّنْ عِندِ رَبِّنَا ۗ وَمَا يَذَّكَّرُ إِلَّآ أُو۟لُوا۟ ٱلْأَلْبَـٰبِ,"Sana Kitap'ı indiren O'dur. Onda Kitap'ın temeli olan kesin anlamlı ayetler vardır, diğerleri de çeşitli anlamlıdırlar. Kalblerinde eğrilik olan kimseler, fitne çıkarmak, kendilerine göre yorumlamak için onların çeşitli anlamlı olanlarına uyarlar. Oysa onların yorumunu ancak Allah bilir. İlimde derinleşmiş olanlar: &quot;Ona inandık, hepsi Rabbimiz'in katındandır&quot; derler. Bunu ancak akıl sahipleri düşünür;"
3,8,3:8,ربنا لا تزغ قلوبنا بعد اذ هديتنا وهب لنا من لدنك رحمة ۚ انك انت الوهاب,رَبَّنَا لَا تُزِغْ قُلُوبَنَا بَعْدَ إِذْ هَدَيْتَنَا وَهَبْ لَنَا مِن لَّدُنكَ رَحْمَةً ۚ إِنَّكَ أَنتَ ٱلْوَهَّابُ,"Rabbimiz! Bizi doğru yola erdirdikten sonra kalblerimizi eğriltme, katından bize rahmet bağışla; şüphesiz Sen sonsuz bağışta bulunansın."
3,9,3:9,ربنا انك جامع الناس ليوم لا ريب فيه ۚ ان الله لا يخلف الميعاد,رَبَّنَآ إِنَّكَ جَامِعُ ٱلنَّاسِ لِيَوْمٍ لَّا رَيْبَ فِيهِ ۚ إِنَّ ٱللَّهَ لَا يُخْلِفُ ٱلْمِيعَادَ,"Rabbimiz! Doğrusu geleceği şüphe götürmeyen günde, insanları toplayacak olan Sensin. Şüphesiz ki Allah verdiği sözden caymaz."
3,10,3:10,ان الذين كفروا۟ لن تغنى عنهم امولهم ولا اولدهم من الله شيا ۖ واو۟ليك هم وقود النار,إِنَّ ٱلَّذِينَ كَفَرُوا۟ لَن تُغْنِىَ عَنْهُمْ أَمْوَٰلُهُمْ وَلَآ أَوْلَـٰدُهُم مِّنَ ٱللَّهِ شَيْـًٔا ۖ وَأُو۟لَـٰٓئِكَ هُمْ وَقُودُ ٱلنَّارِ,"İnkar edenlerin malları ve çocukları, Allah'a karşı onlara bir şey sağlamaz. İşte onlar ateşin yakıtlarıdır."
4,1,4:1, يايها الناس اتقوا۟ ربكم الذى خلقكم من نفس وحدة وخلق منها زوجها وبث منهما رجالا كثيرا ونساء ۚ واتقوا۟ الله الذى تساءلون بهۦ والارحام ۚ ان الله كان عليكم رقيبا, يَـٰٓأَيُّهَا ٱلنَّاسُ ٱتَّقُوا۟ رَبَّكُمُ ٱلَّذِى خَلَقَكُم مِّن نَّفْسٍ وَٰحِدَةٍ وَخَلَقَ مِنْهَا زَوْجَهَا وَبَثَّ مِنْهُمَا رِجَالًا كَثِيرًا وَنِسَآءً ۚ وَٱتَّقُوا۟ ٱللَّهَ ٱلَّذِى تَسَآءَلُونَ بِهِۦ وَٱلْأَرْحَامَ ۚ إِنَّ ٱللَّهَ كَانَ عَلَيْكُمْ رَقِيبًا,"Ey İnsanlar! Sizi bir tek nefisten yaratan, ondan eşini var eden ve ikisinden pek çok erkek ve kadın meydana getiren Rabb'inize hürmetsizlikten sakının. Kendisi adına birbirinizden dilekte bulunduğunuz Allah'ın ve akrabanın haklarına riayetsizliktende sakının. Allah şüphesiz hepinizi görüp gözetmektedir."
4,2,4:2,وءاتوا۟ اليتمى امولهم ۖ ولا تتبدلوا۟ الخبيث بالطيب ۖ ولا تاكلوا۟ امولهم الى امولكم ۚ انهۥ كان حوبا كبيرا,وَءَاتُوا۟ ٱلْيَتَـٰمَىٰٓ أَمْوَٰلَهُمْ ۖ وَلَا تَتَبَدَّلُوا۟ ٱلْخَبِيثَ بِٱلطَّيِّبِ ۖ وَلَا تَأْكُلُوٓا۟ أَمْوَٰلَهُمْ إِلَىٰٓ أَمْوَٰلِكُمْ ۚ إِنَّهُۥ كَانَ حُوبًا كَبِيرًا,"Yetimlere mallarını verin. Temizi murdara değişmeyin, onların mallariyle kendi mallarınızı karıştırarak yemeyin, çünkü bu büyük bir suçtur."
4,3,4:3,وان خفتم الا تقسطوا۟ فى اليتمى فانكحوا۟ ما طاب لكم من النساء مثنى وثلث وربع ۖ فان خفتم الا تعدلوا۟ فوحدة او ما ملكت ايمنكم ۚ ذلك ادنى الا تعولوا۟,وَإِنْ خِفْتُمْ أَلَّا تُقْسِطُوا۟ فِى ٱلْيَتَـٰمَىٰ فَٱنكِحُوا۟ مَا طَابَ لَكُم مِّنَ ٱلنِّسَآءِ مَثْنَىٰ وَثُلَـٰثَ وَرُبَـٰعَ ۖ فَإِنْ خِفْتُمْ أَلَّا تَعْدِلُوا۟ فَوَٰحِدَةً أَوْ مَا مَلَكَتْ أَيْمَـٰنُكُمْ ۚ ذَٰلِكَ أَدْنَىٰٓ أَلَّا تَعُولُوا۟,"Eğer, velisi olduğunuz mal sahibi yetim kızlarla evlenmekle onlara haksızlık yapmaktan korkarsanız onlarla değil, hoşunuza giden başka kadınlarla iki, üç ve dörde kadar evlenebilirsiniz; şayet, aralarında adaletsizlik yapmaktan korkarsanız bir tane almalısınız veya sahip olduğunuz ile yetinmelisiniz. Doğru yoldan sapmamanız için en uygunu budur."
4,4,4:4,وءاتوا۟ النساء صدقتهن نحلة ۚ فان طبن لكم عن شىء منه نفسا فكلوه هنيا مريا,وَءَاتُوا۟ ٱلنِّسَآءَ صَدُقَـٰتِهِنَّ نِحْلَةً ۚ فَإِن طِبْنَ لَكُمْ عَن شَىْءٍ مِّنْهُ نَفْسًا فَكُلُوهُ هَنِيٓـًٔا مَّرِيٓـًٔا,"Kadınlara mehirlerini cömertçe verin, eğer ondan gönül hoşluğu ile size bir şey bağışlarlarsa onu afiyetle yiyin."
4,5,4:5,ولا توتوا۟ السفهاء امولكم التى جعل الله لكم قيما وارزقوهم فيها واكسوهم وقولوا۟ لهم قولا معروفا,وَلَا تُؤْتُوا۟ ٱلسُّفَهَآءَ أَمْوَٰلَكُمُ ٱلَّتِى جَعَلَ ٱللَّهُ لَكُمْ قِيَـٰمًا وَٱرْزُقُوهُمْ فِيهَا وَٱكْسُوهُمْ وَقُولُوا۟ لَهُمْ قَوْلًا مَّعْرُوفًا,"Allah'ın sizi koruyucu kılmış olduğu mallarınızı, beyinsizlere vermeyin, kendilerini bunların geliriyle rızıklandırıp giydirin ve onlara güzel söz söyleyin."
4,6,4:6,وابتلوا۟ اليتمى حتى اذا بلغوا۟ النكاح فان ءانستم منهم رشدا فادفعوا۟ اليهم امولهم ۖ ولا تاكلوها اسرافا وبدارا ان يكبروا۟ ۚ ومن كان غنيا فليستعفف ۖ ومن كان فقيرا فلياكل بالمعروف ۚ فاذا دفعتم اليهم امولهم فاشهدوا۟ عليهم ۚ وكفى بالله حسيبا,وَٱبْتَلُوا۟ ٱلْيَتَـٰمَىٰ حَتَّىٰٓ إِذَا بَلَغُوا۟ ٱلنِّكَاحَ فَإِنْ ءَانَسْتُم مِّنْهُمْ رُشْدًا فَٱدْفَعُوٓا۟ إِلَيْهِمْ أَمْوَٰلَهُمْ ۖ وَلَا تَأْكُلُوهَآ إِسْرَافًا وَبِدَارًا أَن يَكْبَرُوا۟ ۚ وَمَن كَانَ غَنِيًّا فَلْيَسْتَعْفِفْ ۖ وَمَن كَانَ فَقِيرًا فَلْيَأْكُلْ بِٱلْمَعْرُوفِ ۚ فَإِذَا دَفَعْتُمْ إِلَيْهِمْ أَمْوَٰلَهُمْ فَأَشْهِدُوا۟ عَلَيْهِمْ ۚ وَكَفَىٰ بِٱللَّهِ حَسِيبًا,"Yetimleri, evlenme çağına gelene kadar deneyin; onlarda olgunlaşma görürseniz mallarını kendilerine verin; büyüyecekler de geri alacaklar diye onları israf ederek ve tez elden yemeyin. Zengin olan, iffetli olmağa çalışsın, yoksul olan uygun bir şekilde yesin. Mallarını kendilerine verdiğiniz zaman, yanlarında şahid bulundurun. Hesap sormak için Allah yeter."
4,7,4:7,للرجال نصيب مما ترك الولدان والاقربون وللنساء نصيب مما ترك الولدان والاقربون مما قل منه او كثر ۚ نصيبا مفروضا,لِّلرِّجَالِ نَصِيبٌ مِّمَّا تَرَكَ ٱلْوَٰلِدَانِ وَٱلْأَقْرَبُونَ وَلِلنِّسَآءِ نَصِيبٌ مِّمَّا تَرَكَ ٱلْوَٰلِدَانِ وَٱلْأَقْرَبُونَ مِمَّا قَلَّ مِنْهُ أَوْ كَثُرَ ۚ نَصِيبًا مَّفْرُوضًا,"Ana babanın ve yakınların bıraktıklarından, erkeklere hisse vardır. Ana babanın ve yakınların bıraktıklarından kadınlara da hisse vardır. Bunlar, az veya çok, belirli bir hissedir."
4,8,4:8,واذا حضر القسمة او۟لوا۟ القربى واليتمى والمسكين فارزقوهم منه وقولوا۟ لهم قولا معروفا,وَإِذَا حَضَرَ ٱلْقِسْمَةَ أُو۟لُوا۟ ٱلْقُرْبَىٰ وَٱلْيَتَـٰمَىٰ وَٱلْمَسَـٰكِينُ فَٱرْزُقُوهُم مِّنْهُ وَقُولُوا۟ لَهُمْ قَوْلًا مَّعْرُوفًا,"Taksimde, yakınlar, yetimler ve düşkünler bulunursa, ondan onlara da verin, güzel sözler söyleyin."
4,9,4:9,وليخش الذين لو تركوا۟ من خلفهم ذرية ضعفا خافوا۟ عليهم فليتقوا۟ الله وليقولوا۟ قولا سديدا,وَلْيَخْشَ ٱلَّذِينَ لَوْ تَرَكُوا۟ مِنْ خَلْفِهِمْ ذُرِّيَّةً ضِعَـٰفًا خَافُوا۟ عَلَيْهِمْ فَلْيَتَّقُوا۟ ٱللَّهَ وَلْيَقُولُوا۟ قَوْلًا سَدِيدًا,"Arkalarında cılız çocuklar bıraktıkları takdirde, bundan endişe edecek olanlar, haksızlık yapmaktan korksunlar; dürüst söz söylesinler."
4,10,4:10,ان الذين ياكلون امول اليتمى ظلما انما ياكلون فى بطونهم نارا ۖ وسيصلون سعيرا,إِنَّ ٱلَّذِينَ يَأْكُلُونَ أَمْوَٰلَ ٱلْيَتَـٰمَىٰ ظُلْمًا إِنَّمَا يَأْكُلُونَ فِى بُطُونِهِمْ نَارًا ۖ وَسَيَصْلَوْنَ سَعِيرًا,"Yetimlerin mallarını haksız yere yiyenler, karınlarına ancak ateş tıkınmış olurlar, zaten onlar çılgın aleve atılacaklardır."
5,1,5:1, يايها الذين ءامنوا۟ اوفوا۟ بالعقود ۚ احلت لكم بهيمة الانعم الا ما يتلى عليكم غير محلى الصيد وانتم حرم ۗ ان الله يحكم ما يريد, يَـٰٓأَيُّهَا ٱلَّذِينَ ءَامَنُوٓا۟ أَوْفُوا۟ بِٱلْعُقُودِ ۚ أُحِلَّتْ لَكُم بَهِيمَةُ ٱلْأَنْعَـٰمِ إِلَّا مَا يُتْلَىٰ عَلَيْكُمْ غَيْرَ مُحِلِّى ٱلصَّيْدِ وَأَنتُمْ حُرُمٌ ۗ إِنَّ ٱللَّهَ يَحْكُمُ مَا يُرِيدُ,"Ey İnananlar! Akidleri yerine getirin. İhramda iken avlanmayı helal görmeksizin, size bildirilecek olanlar dışında, hayvanlar helal kılındı; Allah dilediği hükmü verir."
5,2,5:2,يايها الذين ءامنوا۟ لا تحلوا۟ شعير الله ولا الشهر الحرام ولا الهدى ولا القليد ولا ءامين البيت الحرام يبتغون فضلا من ربهم ورضونا ۚ واذا حللتم فاصطادوا۟ ۚ ولا يجرمنكم شنان قوم ان صدوكم عن المسجد الحرام ان تعتدوا۟ ۘ وتعاونوا۟ على البر والتقوى ۖ ولا تعاونوا۟ على الاثم والعدون ۚ واتقوا۟ الله ۖ ان الله شديد العقاب,يَـٰٓأَيُّهَا ٱلَّذِينَ ءَامَنُوا۟ لَا تُحِلُّوا۟ شَعَـٰٓئِرَ ٱللَّهِ وَلَا ٱلشَّهْرَ ٱلْحَرَامَ وَلَا ٱلْهَدْىَ وَلَا ٱلْقَلَـٰٓئِدَ وَلَآ ءَآمِّينَ ٱلْبَيْتَ ٱلْحَرَامَ يَبْتَغُونَ فَضْلًا مِّن رَّبِّهِمْ وَرِضْوَٰنًا ۚ وَإِذَا حَلَلْتُمْ فَٱصْطَادُوا۟ ۚ وَلَا يَجْرِمَنَّكُمْ شَنَـَٔانُ قَوْمٍ أَن صَدُّوكُمْ عَنِ ٱلْمَسْجِدِ ٱلْحَرَامِ أَن تَعْتَدُوا۟ ۘ وَتَعَاوَنُوا۟ عَلَى ٱلْبِرِّ وَٱلتَّقْوَىٰ ۖ وَلَا تَعَاوَنُوا۟ عَلَى ٱلْإِثْمِ وَٱلْعُدْوَٰنِ ۚ وَٱتَّقُوا۟ ٱللَّهَ ۖ إِنَّ ٱللَّهَ شَدِيدُ ٱلْعِقَابِ,"Ey İnananlar! Allah'ın nişanelerine, hürmet edilen aya, hediye olan kurbanlığa, gerdanlıklar takılan hayvanlara, Rab'lerinden bol nimet ve rıza talep ederek Beyt-i Haram'a gelenlere sakın hürmetsizlik etmeyin. İhramdan çıktığınız zaman avlanabilirsiniz. Sizi Mescid-i Haram'dan menettiği için bir topluluğa olan kininiz, aşırı gitmenize sebep olmasın; iyilikte ve fenalıktan sakınmakta yardımlaşın, günah işlemek ve aşırı gitmekte yardımlaşmayın. Allah'tan sakının, Allah'ın cezası şiddetlidir."
5,3,5:3,حرمت عليكم الميتة والدم ولحم الخنزير وما اهل لغير الله بهۦ والمنخنقة والموقوذة والمتردية والنطيحة وما اكل السبع الا ما ذكيتم وما ذبح على النصب وان تستقسموا۟ بالازلم ۚ ذلكم فسق ۗ اليوم ييس الذين كفروا۟ من دينكم فلا تخشوهم واخشون ۚ اليوم اكملت لكم دينكم واتممت عليكم نعمتى ورضيت لكم الاسلم دينا ۚ فمن اضطر فى مخمصة غير متجانف لاثم ۙ فان الله غفور رحيم,حُرِّمَتْ عَلَيْكُمُ ٱلْمَيْتَةُ وَٱلدَّمُ وَلَحْمُ ٱلْخِنزِيرِ وَمَآ أُهِلَّ لِغَيْرِ ٱللَّهِ بِهِۦ وَٱلْمُنْخَنِقَةُ وَٱلْمَوْقُوذَةُ وَٱلْمُتَرَدِّيَةُ وَٱلنَّطِيحَةُ وَمَآ أَكَلَ ٱلسَّبُعُ إِلَّا مَا ذَكَّيْتُمْ وَمَا ذُبِحَ عَلَى ٱلنُّصُبِ وَأَن تَسْتَقْسِمُوا۟ بِٱلْأَزْلَـٰمِ ۚ ذَٰلِكُمْ فِسْقٌ ۗ ٱلْيَوْمَ يَئِسَ ٱلَّذِينَ كَفَرُوا۟ مِن دِينِكُمْ فَلَا تَخْشَوْهُمْ وَٱخْشَوْنِ ۚ ٱلْيَوْمَ أَكْمَلْتُ لَكُمْ دِينَكُمْ وَأَتْمَمْتُ عَلَيْكُمْ نِعْمَتِى وَرَضِيتُ لَكُمُ ٱلْإِسْلَـٰمَ دِينًا ۚ فَمَنِ ٱضْطُرَّ فِى مَخْمَصَةٍ غَيْرَ مُتَجَانِفٍ لِّإِثْمٍ ۙ فَإِنَّ ٱللَّهَ غَفُورٌ رَّحِيمٌ,"Leş, kan, domuz eti, Allah'tan başkası adına kesilenler, -canları çıkmadan önce kesmemişseniz, boğulmuş, bir yerine vurularak öldürülmüş, düşüp yuvarlanmış, başka bir hayvan tarafından süsülmüş, yırtıcı hayvan tarafından yenmiş olanları- dikili taşlar üzerine boğazlananlar ile fal oklarıyla kısmet aramanız size haram kılındı; bunlar fasıklıktır. Bugün, inkar edenler sizi dininizden etmekten umutlarını kesmişlerdir, onlardan korkmayın, Benden korkun. Bugün, size dininizi bütünledim, üzerinize olan nimetimi tamamladım, din olarak sizin için İslam'ı beğendim. Açlıktan darda kalan, günaha kaymaksızın yiyebilir. Doğrusu Allah Bağışlayan'dır, merhametli olandır."
5,4,5:4,يسلونك ماذا احل لهم ۖ قل احل لكم الطيبت ۙ وما علمتم من الجوارح مكلبين تعلمونهن مما علمكم الله ۖ فكلوا۟ مما امسكن عليكم واذكروا۟ اسم الله عليه ۖ واتقوا۟ الله ۚ ان الله سريع الحساب,يَسْـَٔلُونَكَ مَاذَآ أُحِلَّ لَهُمْ ۖ قُلْ أُحِلَّ لَكُمُ ٱلطَّيِّبَـٰتُ ۙ وَمَا عَلَّمْتُم مِّنَ ٱلْجَوَارِحِ مُكَلِّبِينَ تُعَلِّمُونَهُنَّ مِمَّا عَلَّمَكُمُ ٱللَّهُ ۖ فَكُلُوا۟ مِمَّآ أَمْسَكْنَ عَلَيْكُمْ وَٱذْكُرُوا۟ ٱسْمَ ٱللَّهِ عَلَيْهِ ۖ وَٱتَّقُوا۟ ٱللَّهَ ۚ إِنَّ ٱللَّهَ سَرِيعُ ٱلْحِسَابِ,"Sana, kendilerine neyin helal kılındığını soruyorlar, de ki: Size temiz olanlar helal kılındı; Allah'ın size öğrettiği üzere alıştırıp yetiştirerek öğrettiğiniz avcı hayvanların sizin için tuttuklarını yiyin ve üzerine Allah'ın adını anın. Allah'tan sakının, doğrusu Allah hesabı çabuk görür."
