chapter_id,verse_number,verse_key,arabic_text,arabic_text_raw,turkish_text
63,10,63:10,وانفقوا۟ من ما رزقنكم من قبل ان ياتى احدكم الموت فيقول رب لولا اخرتنى الى اجل قريب فاصدق واكن من الصلحين,وَأَنفِقُوا۟ مِن مَّا رَزَقْنَـٰكُم مِّن قَبْلِ أَن يَأْتِىَ أَحَدَكُمُ ٱلْمَوْتُ فَيَقُولَ رَبِّ لَوْلَآ أَخَّرْتَنِىٓ إِلَىٰٓ أَجَلٍ قَرِيبٍ فَأَصَّدَّقَ وَأَكُن مِّنَ ٱلصَّـٰلِحِينَ,"Birine ölüm gelip de: &quot;Rabbim! Beni yakın bir süreye kadar ertelesen de, sadaka versem, iyilerden olsam&quot; diyeceği zaman gelmezden önce, size verdiğimiz rızıklardan sarfedin."
64,1,64:1, يسبح لله ما فى السموت وما فى الارض ۖ له الملك وله الحمد ۖ وهو على كل شىء قدير, يُسَبِّحُ لِلَّهِ مَا فِى ٱلسَّمَـٰوَٰتِ وَمَا فِى ٱلْأَرْضِ ۖ لَهُ ٱلْمُلْكُ وَلَهُ ٱلْحَمْدُ ۖ وَهُوَ عَلَىٰ كُلِّ شَىْءٍ قَدِيرٌ,"Göklerde olanlar ve yerde bulunanlar Allah'ı tesbih ederler. Hükümranlık O'nundur, Övülmek O'na mahsustur. O herşeye Kadir'dir."
64,2,64:2,هو الذى خلقكم فمنكم كافر ومنكم مومن ۚ والله بما تعملون بصير,هُوَ ٱلَّذِى خَلَقَكُمْ فَمِنكُمْ كَافِرٌ وَمِنكُم مُّؤْمِنٌ ۚ وَٱللَّهُ بِمَا تَعْمَلُونَ بَصِيرٌ,Sizi yaratan O'dur; kiminiz inkarcı kiminiz mümindir. Allah yaptıklarınızı gören'dir.
64,3,64:3,خلق السموت والارض بالحق وصوركم فاحسن صوركم ۖ واليه المصير,خَلَقَ ٱلسَّمَـٰوَٰتِ وَٱلْأَرْضَ بِٱلْحَقِّ وَصَوَّرَكُمْ فَأَحْسَنَ صُوَرَكُمْ ۖ وَإِلَيْهِ ٱلْمَصِيرُ,Gökleri ve yeri gerektiği gibi yaratmıştır. Size şekil vermiş ve şeklinizi güzel yapmıştır. Dönüş O'nadır.
64,4,64:4,يعلم ما فى السموت والارض ويعلم ما تسرون وما تعلنون ۚ والله عليمۢ بذات الصدور,يَعْلَمُ مَا فِى ٱلسَّمَـٰوَٰتِ وَٱلْأَرْضِ وَيَعْلَمُ مَا تُسِرُّونَ وَمَا تُعْلِنُونَ ۚ وَٱللَّهُ عَلِيمٌۢ بِذَاتِ ٱلصُّدُورِ,"Göklerde ve yerde olanları bilir; gizlediklerinizi de açığa vurduklarınızı da bilir; Allah, kalblerde olanı da bilendir."
64,5,64:5,الم ياتكم نبوا۟ الذين كفروا۟ من قبل فذاقوا۟ وبال امرهم ولهم عذاب اليم,أَلَمْ يَأْتِكُمْ نَبَؤُا۟ ٱلَّذِينَ كَفَرُوا۟ مِن قَبْلُ فَذَاقُوا۟ وَبَالَ أَمْرِهِمْ وَلَهُمْ عَذَابٌ أَلِيمٌ,"Daha önce inkar edip de, inkarlarının karşılığını tadan kimselerin haberi size gelmedi mi? Onlara, can yakıcı azap vardır."
64,6,64:6,ذلك بانهۥ كانت تاتيهم رسلهم بالبينت فقالوا۟ ابشر يهدوننا فكفروا۟ وتولوا۟ ۚ واستغنى الله ۚ والله غنى حميد,ذَٰلِكَ بِأَنَّهُۥ كَانَت تَّأْتِيهِمْ رُسُلُهُم بِٱلْبَيِّنَـٰتِ فَقَالُوٓا۟ أَبَشَرٌ يَهْدُونَنَا فَكَفَرُوا۟ وَتَوَلَّوا۟ ۚ وَّٱسْتَغْنَى ٱللَّهُ ۚ وَٱللَّهُ غَنِىٌّ حَمِيدٌ,"Bu, kendilerine peygamberleri belgelerle geldiğinde: &quot;Bizi doğru yola bir insan mı eriştirecek?&quot; diyerek inkar edip gerçeğe yüz çevirmelerinden ötürüdür. Allah hiçbir şeye muhtaç olmadığını ortaya koymuştur. Allah müstağnidir, övülmeğe layık olandır."
64,7,64:7,زعم الذين كفروا۟ ان لن يبعثوا۟ ۚ قل بلى وربى لتبعثن ثم لتنبون بما عملتم ۚ وذلك على الله يسير,زَعَمَ ٱلَّذِينَ كَفَرُوٓا۟ أَن لَّن يُبْعَثُوا۟ ۚ قُلْ بَلَىٰ وَرَبِّى لَتُبْعَثُنَّ ثُمَّ لَتُنَبَّؤُنَّ بِمَا عَمِلْتُمْ ۚ وَذَٰلِكَ عَلَى ٱللَّهِ يَسِيرٌ,"İnkar edenler, tekrar dirilmeyeceklerini ileri sürerler. De ki: &quot;Evet; Rabbime and olsun ki, şüphesiz diriltileceksiniz ve sonra, yaptıklarınız size bildirilecektir. Bu, Allah'a kolaydır.&quot;"
64,8,64:8,فامنوا۟ بالله ورسولهۦ والنور الذى انزلنا ۚ والله بما تعملون خبير,فَـَٔامِنُوا۟ بِٱللَّهِ وَرَسُولِهِۦ وَٱلنُّورِ ٱلَّذِىٓ أَنزَلْنَا ۚ وَٱللَّهُ بِمَا تَعْمَلُونَ خَبِيرٌ,"Öyleyse Allah'a, Peygamberine ve indirdiğimiz nura, Kuran'a inanın; Allah işlediklerinizden haberdardır."
64,9,64:9,يوم يجمعكم ليوم الجمع ۖ ذلك يوم التغابن ۗ ومن يومنۢ بالله ويعمل صلحا يكفر عنه سياتهۦ ويدخله جنت تجرى من تحتها الانهر خلدين فيها ابدا ۚ ذلك الفوز العظيم,يَوْمَ يَجْمَعُكُمْ لِيَوْمِ ٱلْجَمْعِ ۖ ذَٰلِكَ يَوْمُ ٱلتَّغَابُنِ ۗ وَمَن يُؤْمِنۢ بِٱللَّهِ وَيَعْمَلْ صَـٰلِحًا يُكَفِّرْ عَنْهُ سَيِّـَٔاتِهِۦ وَيُدْخِلْهُ جَنَّـٰتٍ تَجْرِى مِن تَحْتِهَا ٱلْأَنْهَـٰرُ خَـٰلِدِينَ فِيهَآ أَبَدًا ۚ ذَٰلِكَ ٱلْفَوْزُ ٱلْعَظِيمُ,"Toplanma günü için, sizi bir araya getirdiği zaman, işte o, kimin aldandığının ortaya çıkacağı gündür; Allah'a kim inanmış ve yararlı iş işlemişse, Allah onun kötülüklerini örter, onu içinde temelli ve sonsuz kalacağı, içlerinden ırmaklar akan cennetlere koyar; büyük kurtuluş işte budur."
64,10,64:10,والذين كفروا۟ وكذبوا۟ بايتنا او۟ليك اصحب النار خلدين فيها ۖ وبيس المصير,وَٱلَّذِينَ كَفَرُوا۟ وَكَذَّبُوا۟ بِـَٔايَـٰتِنَآ أُو۟لَـٰٓئِكَ أَصْحَـٰبُ ٱلنَّارِ خَـٰلِدِينَ فِيهَا ۖ وَبِئْسَ ٱلْمَصِيرُ,"İnkar edip, ayetlerimizi yalanlayanlar, işte onlar da ateşliklerdir, orada temellidirler. Ne kötü bir dönüştür!"
65,1,65:1, يايها النبى اذا طلقتم النساء فطلقوهن لعدتهن واحصوا۟ العدة ۖ واتقوا۟ الله ربكم ۖ لا تخرجوهن منۢ بيوتهن ولا يخرجن الا ان ياتين بفحشة مبينة ۚ وتلك حدود الله ۚ ومن يتعد حدود الله فقد ظلم نفسهۥ ۚ لا تدرى لعل الله يحدث بعد ذلك امرا, يَـٰٓأَيُّهَا ٱلنَّبِىُّ إِذَا طَلَّقْتُمُ ٱلنِّسَآءَ فَطَلِّقُوهُنَّ لِعِدَّتِهِنَّ وَأَحْصُوا۟ ٱلْعِدَّةَ ۖ وَٱتَّقُوا۟ ٱللَّهَ رَبَّكُمْ ۖ لَا تُخْرِجُوهُنَّ مِنۢ بُيُوتِهِنَّ وَلَا يَخْرُجْنَ إِلَّآ أَن يَأْتِينَ بِفَـٰحِشَةٍ مُّبَيِّنَةٍ ۚ وَتِلْكَ حُدُودُ ٱللَّهِ ۚ وَمَن يَتَعَدَّ حُدُودَ ٱللَّهِ فَقَدْ ظَلَمَ نَفْسَهُۥ ۚ لَا تَدْرِى لَعَلَّ ٱللَّهَ يُحْدِثُ بَعْدَ ذَٰلِكَ أَمْرًا,"Ey Peygamber! Kadınları boşayacağınızda, onları, iddetlerini gözeterek boşayın ve iddeti sayın; Rabbiniz olan Allah'tan sakının; onları, apaçık bir hayasızlık yapmaları hali bir yana evlerinden çıkarmayın, onlar da çıkmasınlar. Bunlar, Allah'ın sınırlarıdır. Allah'ın sınırlarını kim aşarsa, şüphesiz, kendine yazık etmiş olur. Bilmezsin, olur ki, Allah bunun ardından bir hal meydana getirir."
65,2,65:2,فاذا بلغن اجلهن فامسكوهن بمعروف او فارقوهن بمعروف واشهدوا۟ ذوى عدل منكم واقيموا۟ الشهدة لله ۚ ذلكم يوعظ بهۦ من كان يومن بالله واليوم الاخر ۚ ومن يتق الله يجعل لهۥ مخرجا,فَإِذَا بَلَغْنَ أَجَلَهُنَّ فَأَمْسِكُوهُنَّ بِمَعْرُوفٍ أَوْ فَارِقُوهُنَّ بِمَعْرُوفٍ وَأَشْهِدُوا۟ ذَوَىْ عَدْلٍ مِّنكُمْ وَأَقِيمُوا۟ ٱلشَّهَـٰدَةَ لِلَّهِ ۚ ذَٰلِكُمْ يُوعَظُ بِهِۦ مَن كَانَ يُؤْمِنُ بِٱللَّهِ وَٱلْيَوْمِ ٱلْـَٔاخِرِ ۚ وَمَن يَتَّقِ ٱللَّهَ يَجْعَل لَّهُۥ مَخْرَجًا,"Kadınların iddet süreleri biteceğinde, onları ya uygun bir şekilde alıkoyun, ya da onlardan ayrılın; içinizden de iki adil şahit getirin; şahidliği Allah için yapın; işte bu, Allah'a ve ahiret gününe inanan kimseye verilen öğüttür. Allah, kendisine karşı gelmekten sakınan kimseye kurtuluş yolu sağlar, ona beklemediği yerden rızık verir. Allah'a güvenen kimseye O yeter. Allah, buyruğunu yerine getirendir. Allah her şey için bir ölçü var etmiştir."
65,3,65:3,ويرزقه من حيث لا يحتسب ۚ ومن يتوكل على الله فهو حسبهۥ ۚ ان الله بلغ امرهۦ ۚ قد جعل الله لكل شىء قدرا,وَيَرْزُقْهُ مِنْ حَيْثُ لَا يَحْتَسِبُ ۚ وَمَن يَتَوَكَّلْ عَلَى ٱللَّهِ فَهُوَ حَسْبُهُۥٓ ۚ إِنَّ ٱللَّهَ بَـٰلِغُ أَمْرِهِۦ ۚ قَدْ جَعَلَ ٱللَّهُ لِكُلِّ شَىْءٍ قَدْرًا,"Kadınların iddet süreleri biteceğinde, onları ya uygun bir şekilde alıkoyun, ya da onlardan ayrılın; içinizden de iki adil şahit getirin; şahidliği Allah için yapın; işte bu, Allah'a ve ahiret gününe inanan kimseye verilen öğüttür. Allah, kendisine karşı gelmekten sakınan kimseye kurtuluş yolu sağlar, ona beklemediği yerden rızık verir. Allah'a güvenen kimseye O yeter. Allah, buyruğunu yerine getirendir. Allah her şey için bir ölçü var etmiştir."
65,4,65:4,والى ييسن من المحيض من نسايكم ان ارتبتم فعدتهن ثلثة اشهر والى لم يحضن ۚ واو۟لت الاحمال اجلهن ان يضعن حملهن ۚ ومن يتق الله يجعل لهۥ من امرهۦ يسرا,وَٱلَّـٰٓـِٔى يَئِسْنَ مِنَ ٱلْمَحِيضِ مِن نِّسَآئِكُمْ إِنِ ٱرْتَبْتُمْ فَعِدَّتُهُنَّ ثَلَـٰثَةُ أَشْهُرٍ وَٱلَّـٰٓـِٔى لَمْ يَحِضْنَ ۚ وَأُو۟لَـٰتُ ٱلْأَحْمَالِ أَجَلُهُنَّ أَن يَضَعْنَ حَمْلَهُنَّ ۚ وَمَن يَتَّقِ ٱللَّهَ يَجْعَل لَّهُۥ مِنْ أَمْرِهِۦ يُسْرًا,"Kadınlarınızdan ay hali görmekten kesilenler ile henüz ay hali görmemiş olanların iddetleri hususunda şüpheye düşerseniz, bilin ki, onların iddet beklemesi üç aydır; gebe olanların iddeti, doğurmaları ile tamamlanır. Allah, buyruğuna karşı gelmekten sakınan kimseye işinde kolaylık verir."
65,5,65:5,ذلك امر الله انزلهۥ اليكم ۚ ومن يتق الله يكفر عنه سياتهۦ ويعظم لهۥ اجرا,ذَٰلِكَ أَمْرُ ٱللَّهِ أَنزَلَهُۥٓ إِلَيْكُمْ ۚ وَمَن يَتَّقِ ٱللَّهَ يُكَفِّرْ عَنْهُ سَيِّـَٔاتِهِۦ وَيُعْظِمْ لَهُۥٓ أَجْرًا,"Bu, Allah'ın size indirmiş olduğu buyruğudur. Kim Allah'ın buyruğuna karşı gelmekten sakınırsa, O, onun kötülüklerini örter, ecrini büyültür."
65,6,65:6,اسكنوهن من حيث سكنتم من وجدكم ولا تضاروهن لتضيقوا۟ عليهن ۚ وان كن او۟لت حمل فانفقوا۟ عليهن حتى يضعن حملهن ۚ فان ارضعن لكم فاتوهن اجورهن ۖ واتمروا۟ بينكم بمعروف ۖ وان تعاسرتم فسترضع لهۥ اخرى,أَسْكِنُوهُنَّ مِنْ حَيْثُ سَكَنتُم مِّن وُجْدِكُمْ وَلَا تُضَآرُّوهُنَّ لِتُضَيِّقُوا۟ عَلَيْهِنَّ ۚ وَإِن كُنَّ أُو۟لَـٰتِ حَمْلٍ فَأَنفِقُوا۟ عَلَيْهِنَّ حَتَّىٰ يَضَعْنَ حَمْلَهُنَّ ۚ فَإِنْ أَرْضَعْنَ لَكُمْ فَـَٔاتُوهُنَّ أُجُورَهُنَّ ۖ وَأْتَمِرُوا۟ بَيْنَكُم بِمَعْرُوفٍ ۖ وَإِن تَعَاسَرْتُمْ فَسَتُرْضِعُ لَهُۥٓ أُخْرَىٰ,"Boşadığınız, fakat iddeti dolmamış kadınları gücünüz nispetinde, kendi oturduğunuz yerde oturtun. Onları sıkıntıya sokmak için zarar vermeye kalkışmayın. Eğer hamile iseler, doğurmalarına kadar nafakalarını verin. Çocuğu sizin için emzirirlerse, onlara ücretlerini ödeyin; aranızda uygun bir şekilde anlaşın; eğer güçlükle karşılaşırsanız çocuğu başka bir kadın emzirebilir."
65,7,65:7,لينفق ذو سعة من سعتهۦ ۖ ومن قدر عليه رزقهۥ فلينفق مما ءاتىه الله ۚ لا يكلف الله نفسا الا ما ءاتىها ۚ سيجعل الله بعد عسر يسرا,لِيُنفِقْ ذُو سَعَةٍ مِّن سَعَتِهِۦ ۖ وَمَن قُدِرَ عَلَيْهِ رِزْقُهُۥ فَلْيُنفِقْ مِمَّآ ءَاتَىٰهُ ٱللَّهُ ۚ لَا يُكَلِّفُ ٱللَّهُ نَفْسًا إِلَّا مَآ ءَاتَىٰهَا ۚ سَيَجْعَلُ ٱللَّهُ بَعْدَ عُسْرٍ يُسْرًا,"Varlıklı olan kimse, nafakayı varlığına göre versin; rızkı ancak kendisine yetecek kadar verilmiş olan kimse, Allah'ın kendisine verdiğinden versin; Allah kimseye, verdiği rızkı aşan bir yük yüklemez. Allah, güçlükten sonra kolaylık verir."
65,8,65:8,وكاين من قرية عتت عن امر ربها ورسلهۦ فحاسبنها حسابا شديدا وعذبنها عذابا نكرا,وَكَأَيِّن مِّن قَرْيَةٍ عَتَتْ عَنْ أَمْرِ رَبِّهَا وَرُسُلِهِۦ فَحَاسَبْنَـٰهَا حِسَابًا شَدِيدًا وَعَذَّبْنَـٰهَا عَذَابًا نُّكْرًا,"Rablerinin ve O'nun peygamberlerinin buyruğundan çıkan nice kasabalar halkını Biz, çetin bir hesaba çekmiş, onları, görülmedik bir azaba uğratmışızdır."
65,9,65:9,فذاقت وبال امرها وكان عقبة امرها خسرا,فَذَاقَتْ وَبَالَ أَمْرِهَا وَكَانَ عَـٰقِبَةُ أَمْرِهَا خُسْرًا,"Onlar, işlerinin karşılığını tattılar; işlerinin sonu hüsran oldu."
65,10,65:10,اعد الله لهم عذابا شديدا ۖ فاتقوا۟ الله ياو۟لى الالبب الذين ءامنوا۟ ۚ قد انزل الله اليكم ذكرا,أَعَدَّ ٱللَّهُ لَهُمْ عَذَابًا شَدِيدًا ۖ فَٱتَّقُوا۟ ٱللَّهَ يَـٰٓأُو۟لِى ٱلْأَلْبَـٰبِ ٱلَّذِينَ ءَامَنُوا۟ ۚ قَدْ أَنزَلَ ٱللَّهُ إِلَيْكُمْ ذِكْرًا,Allah onlara çetin bir azap hazırlamıştır. Ey inanmış olan akıl sahipleri! Allah'tan sakının; Allah size Kuran'ı indirmiştir.
66,1,66:1, يايها النبى لم تحرم ما احل الله لك ۖ تبتغى مرضات ازوجك ۚ والله غفور رحيم, يَـٰٓأَيُّهَا ٱلنَّبِىُّ لِمَ تُحَرِّمُ مَآ أَحَلَّ ٱللَّهُ لَكَ ۖ تَبْتَغِى مَرْضَاتَ أَزْوَٰجِكَ ۚ وَٱللَّهُ غَفُورٌ رَّحِيمٌ,"Eşlerinin rızasını gözeterek, Allah'ın sana helal kıldığı şeyi niçin kendine yasak ediyorsun? Allah bağışlayandır, acıyandır."
66,2,66:2,قد فرض الله لكم تحلة ايمنكم ۚ والله مولىكم ۖ وهو العليم الحكيم,قَدْ فَرَضَ ٱللَّهُ لَكُمْ تَحِلَّةَ أَيْمَـٰنِكُمْ ۚ وَٱللَّهُ مَوْلَىٰكُمْ ۖ وَهُوَ ٱلْعَلِيمُ ٱلْحَكِيمُ,"Allah şüphesiz size, yeminlerinizi keffaretle geri almanızı meşru kılmıştır. Allah sizin dostunuzdur. O, bilendir, Hakim'dir."
66,3,66:3,واذ اسر النبى الى بعض ازوجهۦ حديثا فلما نبات بهۦ واظهره الله عليه عرف بعضهۥ واعرض عنۢ بعض ۖ فلما نباها بهۦ قالت من انۢباك هذا ۖ قال نبانى العليم الخبير,وَإِذْ أَسَرَّ ٱلنَّبِىُّ إِلَىٰ بَعْضِ أَزْوَٰجِهِۦ حَدِيثًا فَلَمَّا نَبَّأَتْ بِهِۦ وَأَظْهَرَهُ ٱللَّهُ عَلَيْهِ عَرَّفَ بَعْضَهُۥ وَأَعْرَضَ عَنۢ بَعْضٍ ۖ فَلَمَّا نَبَّأَهَا بِهِۦ قَالَتْ مَنْ أَنۢبَأَكَ هَـٰذَا ۖ قَالَ نَبَّأَنِىَ ٱلْعَلِيمُ ٱلْخَبِيرُ,"Peygamber, eşlerinden birine gizlice bir söz söylemişti. O, bunu Peygamberin diğer bir eşine haber verince, Allah da Peygambere durumu bildirmiş, o da bir kısmını yüzüne vurmuş bir kısmını yüzüne vurmaktan geri durmuştu. Eşine, gizlice söylediği şeyibaşkasına nakletmiş olduğunu bildirince, eşi: &quot;Bunu sana kim haber verdi?&quot; demiş, o da: &quot;Bana, herşeyi bilen ve herşeyden haberdar olan Allah haber verdi&quot; demişti."
66,4,66:4,ان تتوبا الى الله فقد صغت قلوبكما ۖ وان تظهرا عليه فان الله هو مولىه وجبريل وصلح المومنين ۖ والمليكة بعد ذلك ظهير,إِن تَتُوبَآ إِلَى ٱللَّهِ فَقَدْ صَغَتْ قُلُوبُكُمَا ۖ وَإِن تَظَـٰهَرَا عَلَيْهِ فَإِنَّ ٱللَّهَ هُوَ مَوْلَىٰهُ وَجِبْرِيلُ وَصَـٰلِحُ ٱلْمُؤْمِنِينَ ۖ وَٱلْمَلَـٰٓئِكَةُ بَعْدَ ذَٰلِكَ ظَهِيرٌ,"Ey Peygamber'in eşleri! Eğer ikiniz de Allah'a tevbe ederseniz, kaymış olan kalpleriniz düzelmiş olur. Eğer eşinizin aleyhinde yardımlaşarak bir şey yapmağa kalkarsanız, bilin ki Allah onun dostu, bundan başka Cebrail, iyi müminler ve melekler de yardımcısıdır."
66,5,66:5,عسى ربهۥ ان طلقكن ان يبدلهۥ ازوجا خيرا منكن مسلمت مومنت قنتت تيبت عبدت سيحت ثيبت وابكارا,عَسَىٰ رَبُّهُۥٓ إِن طَلَّقَكُنَّ أَن يُبْدِلَهُۥٓ أَزْوَٰجًا خَيْرًا مِّنكُنَّ مُسْلِمَـٰتٍ مُّؤْمِنَـٰتٍ قَـٰنِتَـٰتٍ تَـٰٓئِبَـٰتٍ عَـٰبِدَٰتٍ سَـٰٓئِحَـٰتٍ ثَيِّبَـٰتٍ وَأَبْكَارًا,"Ey Peygamber'in eşleri! Eğer o sizi boşarsa, Rabbi ona; sizden daha iyi olan, kendini Allah'a veren, inanan, boyun eğen, tevbe eden, kulluk eden, oruç tutan, dul ve bakire eşler verebilir."
66,6,66:6,يايها الذين ءامنوا۟ قوا۟ انفسكم واهليكم نارا وقودها الناس والحجارة عليها مليكة غلاظ شداد لا يعصون الله ما امرهم ويفعلون ما يومرون,يَـٰٓأَيُّهَا ٱلَّذِينَ ءَامَنُوا۟ قُوٓا۟ أَنفُسَكُمْ وَأَهْلِيكُمْ نَارًا وَقُودُهَا ٱلنَّاسُ وَٱلْحِجَارَةُ عَلَيْهَا مَلَـٰٓئِكَةٌ غِلَاظٌ شِدَادٌ لَّا يَعْصُونَ ٱللَّهَ مَآ أَمَرَهُمْ وَيَفْعَلُونَ مَا يُؤْمَرُونَ,"Ey inananlar! Kendinizi ve çoluk çocuğunuzu cehennem ateşinden koruyun; onun yakıtı, insanlar ve taşlardır; görevlileri, Allah'ın kendilerine verdiği emirlere baş kaldırmayan, kendilerine buyrulanları yerine getiren pek haşin meleklerdir."
66,7,66:7,يايها الذين كفروا۟ لا تعتذروا۟ اليوم ۖ انما تجزون ما كنتم تعملون,يَـٰٓأَيُّهَا ٱلَّذِينَ كَفَرُوا۟ لَا تَعْتَذِرُوا۟ ٱلْيَوْمَ ۖ إِنَّمَا تُجْزَوْنَ مَا كُنتُمْ تَعْمَلُونَ,"&quot;Ey inkar edenler! Bugün özür beyan etmeyin, ancak işlediklerinizin karşılığını görmektesiniz&quot; denir."
66,8,66:8,يايها الذين ءامنوا۟ توبوا۟ الى الله توبة نصوحا عسى ربكم ان يكفر عنكم سياتكم ويدخلكم جنت تجرى من تحتها الانهر يوم لا يخزى الله النبى والذين ءامنوا۟ معهۥ ۖ نورهم يسعى بين ايديهم وبايمنهم يقولون ربنا اتمم لنا نورنا واغفر لنا ۖ انك على كل شىء قدير,يَـٰٓأَيُّهَا ٱلَّذِينَ ءَامَنُوا۟ تُوبُوٓا۟ إِلَى ٱللَّهِ تَوْبَةً نَّصُوحًا عَسَىٰ رَبُّكُمْ أَن يُكَفِّرَ عَنكُمْ سَيِّـَٔاتِكُمْ وَيُدْخِلَكُمْ جَنَّـٰتٍ تَجْرِى مِن تَحْتِهَا ٱلْأَنْهَـٰرُ يَوْمَ لَا يُخْزِى ٱللَّهُ ٱلنَّبِىَّ وَٱلَّذِينَ ءَامَنُوا۟ مَعَهُۥ ۖ نُورُهُمْ يَسْعَىٰ بَيْنَ أَيْدِيهِمْ وَبِأَيْمَـٰنِهِمْ يَقُولُونَ رَبَّنَآ أَتْمِمْ لَنَا نُورَنَا وَٱغْفِرْ لَنَآ ۖ إِنَّكَ عَلَىٰ كُلِّ شَىْءٍ قَدِيرٌ,"Ey inananlar! Yürekten tevbe ederek Allah'a dönün ki, Rabbiniz kötülüklerinizi örtsün, sizi, içlerinden ırmaklar akan cennetlere koysun. Allah'ın Peygamberini ve onunla beraber olan müminleri utandırmayacağı o gün, ışıkları önlerinde ve defterleri sağlarından verilmiş olarak yürürler ve: &quot;Rabbimiz! Işığımızı tamamla, bizi bağışla, doğrusu Sen herşeye Kadir'sin&quot; derler."
66,9,66:9,يايها النبى جهد الكفار والمنفقين واغلظ عليهم ۚ وماوىهم جهنم ۖ وبيس المصير,يَـٰٓأَيُّهَا ٱلنَّبِىُّ جَـٰهِدِ ٱلْكُفَّارَ وَٱلْمُنَـٰفِقِينَ وَٱغْلُظْ عَلَيْهِمْ ۚ وَمَأْوَىٰهُمْ جَهَنَّمُ ۖ وَبِئْسَ ٱلْمَصِيرُ,"Ey Peygamber! İnkarcılarla ve ikiyüzlülerle savaş; onlara karşı sert davran. Onların varacakları yer cehennemdir, ne kötü dönüştür!..."
66,10,66:10,ضرب الله مثلا للذين كفروا۟ امرات نوح وامرات لوط ۖ كانتا تحت عبدين من عبادنا صلحين فخانتاهما فلم يغنيا عنهما من الله شيا وقيل ادخلا النار مع الدخلين,ضَرَبَ ٱللَّهُ مَثَلًا لِّلَّذِينَ كَفَرُوا۟ ٱمْرَأَتَ نُوحٍ وَٱمْرَأَتَ لُوطٍ ۖ كَانَتَا تَحْتَ عَبْدَيْنِ مِنْ عِبَادِنَا صَـٰلِحَيْنِ فَخَانَتَاهُمَا فَلَمْ يُغْنِيَا عَنْهُمَا مِنَ ٱللَّهِ شَيْـًٔا وَقِيلَ ٱدْخُلَا ٱلنَّارَ مَعَ ٱلدَّٰخِلِينَ,"Allah, inkar edenlere, Nuh'un karısıyla Lut'un karısını misal gösterir: Onlar, kullarımızdan iki iyi kulun nikahı altında iken onlara karşı hainlik edip inkarlarını gizlemişlerdi de iki peygamber Allah'tan gelen azabı onlardan savamamışlardı. O iki kadına: &quot;Cehenneme girenlerle beraber siz de girin&quot; dendi."
67,1,67:1, تبرك الذى بيده الملك وهو على كل شىء قدير, تَبَـٰرَكَ ٱلَّذِى بِيَدِهِ ٱلْمُلْكُ وَهُوَ عَلَىٰ كُلِّ شَىْءٍ قَدِيرٌ,Hükümranlık elinde olan Allah yücedir ve O herşeye Kadir'dir.
67,2,67:2,الذى خلق الموت والحيوة ليبلوكم ايكم احسن عملا ۚ وهو العزيز الغفور,ٱلَّذِى خَلَقَ ٱلْمَوْتَ وَٱلْحَيَوٰةَ لِيَبْلُوَكُمْ أَيُّكُمْ أَحْسَنُ عَمَلًا ۚ وَهُوَ ٱلْعَزِيزُ ٱلْغَفُورُ,"Hanginizin daha iyi iş işlediğini belirtmek için, ölümü ve dirimi (hayatı) yaratan O'dur. O, güçlüdür, bağışlayandır."
67,3,67:3,الذى خلق سبع سموت طباقا ۖ ما ترى فى خلق الرحمن من تفوت ۖ فارجع البصر هل ترى من فطور,ٱلَّذِى خَلَقَ سَبْعَ سَمَـٰوَٰتٍ طِبَاقًا ۖ مَّا تَرَىٰ فِى خَلْقِ ٱلرَّحْمَـٰنِ مِن تَفَـٰوُتٍ ۖ فَٱرْجِعِ ٱلْبَصَرَ هَلْ تَرَىٰ مِن فُطُورٍ,"Gökleri yedi kat üzerine yaratan O'dur. Rahman'ın bu yaratmasında bir düzensizlik bulamazsın. Gözünü bir çevir bak, bir çatlak görebilir misin?"
