chapter_id,verse_number,verse_key,arabic_text,arabic_text_raw,turkish_text
17,10,17:10,وان الذين لا يومنون بالاخرة اعتدنا لهم عذابا اليما,وَأَنَّ ٱلَّذِينَ لَا يُؤْمِنُونَ بِٱلْـَٔاخِرَةِ أَعْتَدْنَا لَهُمْ عَذَابًا أَلِيمًا,"Doğrusu bu Kuran en doğru yola götürür ve yararlı iş yapan müminlere büyük ecir olduğunu, ahirete inanmayanlara can yakıcı bir azap hazırladığımızı müjdeler."
18,1,18:1, الحمد لله الذى انزل على عبده الكتب ولم يجعل لهۥ عوجا ۜ, ٱلْحَمْدُ لِلَّهِ ٱلَّذِىٓ أَنزَلَ عَلَىٰ عَبْدِهِ ٱلْكِتَـٰبَ وَلَمْ يَجْعَل لَّهُۥ عِوَجَا ۜ,"Hamd Allah'a mahsustur ki, kendi katından şiddetli bir baskını haber vermek ve yararlı iş yapan müminlere, içinde temelli kalacakları güzel bir mükafatı müjdelemek ve: &quot;Allah çocuk edindi&quot; diyenleri uyarmak için kuluna eğri bir taraf bırakmadığı dosdoğru Kitap'ı indirmiştir."
18,2,18:2,قيما لينذر باسا شديدا من لدنه ويبشر المومنين الذين يعملون الصلحت ان لهم اجرا حسنا,قَيِّمًا لِّيُنذِرَ بَأْسًا شَدِيدًا مِّن لَّدُنْهُ وَيُبَشِّرَ ٱلْمُؤْمِنِينَ ٱلَّذِينَ يَعْمَلُونَ ٱلصَّـٰلِحَـٰتِ أَنَّ لَهُمْ أَجْرًا حَسَنًا,"Hamd Allah'a mahsustur ki, kendi katından şiddetli bir baskını haber vermek ve yararlı iş yapan müminlere, içinde temelli kalacakları güzel bir mükafatı müjdelemek ve: &quot;Allah çocuk edindi&quot; diyenleri uyarmak için kuluna eğri bir taraf bırakmadığı dosdoğru Kitap'ı indirmiştir."
18,3,18:3,مكثين فيه ابدا,مَّـٰكِثِينَ فِيهِ أَبَدًا,"Hamd Allah'a mahsustur ki, kendi katından şiddetli bir baskını haber vermek ve yararlı iş yapan müminlere, içinde temelli kalacakları güzel bir mükafatı müjdelemek ve: &quot;Allah çocuk edindi&quot; diyenleri uyarmak için kuluna eğri bir taraf bırakmadığı dosdoğru Kitap'ı indirmiştir."
18,4,18:4,وينذر الذين قالوا۟ اتخذ الله ولدا,وَيُنذِرَ ٱلَّذِينَ قَالُوا۟ ٱتَّخَذَ ٱللَّهُ وَلَدًا,"Hamd Allah'a mahsustur ki, kendi katından şiddetli bir baskını haber vermek ve yararlı iş yapan müminlere, içinde temelli kalacakları güzel bir mükafatı müjdelemek ve: &quot;Allah çocuk edindi&quot; diyenleri uyarmak için kuluna eğri bir taraf bırakmadığı dosdoğru Kitap'ı indirmiştir."
18,5,18:5,ما لهم بهۦ من علم ولا لابايهم ۚ كبرت كلمة تخرج من افوههم ۚ ان يقولون الا كذبا,مَّا لَهُم بِهِۦ مِنْ عِلْمٍ وَلَا لِـَٔابَآئِهِمْ ۚ كَبُرَتْ كَلِمَةً تَخْرُجُ مِنْ أَفْوَٰهِهِمْ ۚ إِن يَقُولُونَ إِلَّا كَذِبًا,Allah'ın çocuk edindiğine dair ne kendilerinin ve ne de babalarının bir bilgisi vardır. Ağızlarından çıkan söz ne büyük iftiradır. Onlar yalnız ve yalnız yalan söylerler.
18,6,18:6,فلعلك بخع نفسك على ءاثرهم ان لم يومنوا۟ بهذا الحديث اسفا,فَلَعَلَّكَ بَـٰخِعٌ نَّفْسَكَ عَلَىٰٓ ءَاثَـٰرِهِمْ إِن لَّمْ يُؤْمِنُوا۟ بِهَـٰذَا ٱلْحَدِيثِ أَسَفًا,Bu söze inanmayanların ardından üzülerek nerdeyse kendini mahvedeceksin!
18,7,18:7,انا جعلنا ما على الارض زينة لها لنبلوهم ايهم احسن عملا,إِنَّا جَعَلْنَا مَا عَلَى ٱلْأَرْضِ زِينَةً لَّهَا لِنَبْلُوَهُمْ أَيُّهُمْ أَحْسَنُ عَمَلًا,"İnsanların hangisinin daha iyi iş işlediğini ortaya koyalım diye, yeryüzünde olan şeyleri, yeryüzünün süsü yaptık."
18,8,18:8,وانا لجعلون ما عليها صعيدا جرزا,وَإِنَّا لَجَـٰعِلُونَ مَا عَلَيْهَا صَعِيدًا جُرُزًا,"Şüphesiz Biz, yeryüzünde olanları kupkuru bir toprak haline getirebiliriz."
18,9,18:9,ام حسبت ان اصحب الكهف والرقيم كانوا۟ من ءايتنا عجبا,أَمْ حَسِبْتَ أَنَّ أَصْحَـٰبَ ٱلْكَهْفِ وَٱلرَّقِيمِ كَانُوا۟ مِنْ ءَايَـٰتِنَا عَجَبًا,Yoksa sen Mağara ve Kitap ehlini şaşılacak ayetlerimizden mi zannettin?
18,10,18:10,اذ اوى الفتية الى الكهف فقالوا۟ ربنا ءاتنا من لدنك رحمة وهيي لنا من امرنا رشدا,إِذْ أَوَى ٱلْفِتْيَةُ إِلَى ٱلْكَهْفِ فَقَالُوا۟ رَبَّنَآ ءَاتِنَا مِن لَّدُنكَ رَحْمَةً وَهَيِّئْ لَنَا مِنْ أَمْرِنَا رَشَدًا,"Birkaç genç mağaraya sığınmış: &quot;Rabbimiz! Katından bize rahmet ver ve işimizde doğruyu göster, bizi başarılı kıl&quot; demişlerdi."
19,1,19:1, كهيعص, كٓهيعٓصٓ,"Kaf, Ha, Ya, Ayn, Sad."
19,2,19:2,ذكر رحمت ربك عبدهۥ زكريا,ذِكْرُ رَحْمَتِ رَبِّكَ عَبْدَهُۥ زَكَرِيَّآ,"Bu, Rabbinin kulu Zekeriya'ya olan rahmetini anmadır."
19,3,19:3,اذ نادى ربهۥ نداء خفيا,إِذْ نَادَىٰ رَبَّهُۥ نِدَآءً خَفِيًّا,O Rabbine içinden yalvarmıştı.
19,4,19:4,قال رب انى وهن العظم منى واشتعل الراس شيبا ولم اكنۢ بدعايك رب شقيا,قَالَ رَبِّ إِنِّى وَهَنَ ٱلْعَظْمُ مِنِّى وَٱشْتَعَلَ ٱلرَّأْسُ شَيْبًا وَلَمْ أَكُنۢ بِدُعَآئِكَ رَبِّ شَقِيًّا,"Şöyle demişti: &quot;Rabbim! Gerçekten kemiklerim zayıfladı, saçlarım ağardı. Rabbim! Sana yalvarmakla şimdiye kadar bedbaht olup bir şeyden mahrum kalmadım.&quot;"
19,5,19:5,وانى خفت المولى من وراءى وكانت امراتى عاقرا فهب لى من لدنك وليا,وَإِنِّى خِفْتُ ٱلْمَوَٰلِىَ مِن وَرَآءِى وَكَانَتِ ٱمْرَأَتِى عَاقِرًا فَهَبْ لِى مِن لَّدُنكَ وَلِيًّا,"Doğrusu, benden sonra yerime geçecek yakınlarımın iyi hareket etmeyeceklerinden korkuyorum. Karım da kısırdır. Katından bana bir oğul bağışla ki, bana ve Yakub oğullarına mirasçı olsun. Rabbim! Onun, rızanı kazanmasını da sağla.&quot;"
19,6,19:6,يرثنى ويرث من ءال يعقوب ۖ واجعله رب رضيا,يَرِثُنِى وَيَرِثُ مِنْ ءَالِ يَعْقُوبَ ۖ وَٱجْعَلْهُ رَبِّ رَضِيًّا,"Doğrusu, benden sonra yerime geçecek yakınlarımın iyi hareket etmeyeceklerinden korkuyorum. Karım da kısırdır. Katından bana bir oğul bağışla ki, bana ve Yakub oğullarına mirasçı olsun. Rabbim! Onun, rızanı kazanmasını da sağla.&quot;"
19,7,19:7,يزكريا انا نبشرك بغلم اسمهۥ يحيى لم نجعل لهۥ من قبل سميا,يَـٰزَكَرِيَّآ إِنَّا نُبَشِّرُكَ بِغُلَـٰمٍ ٱسْمُهُۥ يَحْيَىٰ لَمْ نَجْعَل لَّهُۥ مِن قَبْلُ سَمِيًّا,"Allah: &quot;Ey Zekeriya! Sana, Yahya isminde bir oğlanı müjdeliyoruz. Bu adı daha önce kimseye vermemiştik&quot; buyurdu."
19,8,19:8,قال رب انى يكون لى غلم وكانت امراتى عاقرا وقد بلغت من الكبر عتيا,قَالَ رَبِّ أَنَّىٰ يَكُونُ لِى غُلَـٰمٌ وَكَانَتِ ٱمْرَأَتِى عَاقِرًا وَقَدْ بَلَغْتُ مِنَ ٱلْكِبَرِ عِتِيًّا,"Zekeriya: &quot;Rabbim! Karım kısır, ben de son derece kocamışken nasıl oğlum olabilir?&quot; dedi."
19,9,19:9,قال كذلك قال ربك هو على هين وقد خلقتك من قبل ولم تك شيا,قَالَ كَذَٰلِكَ قَالَ رَبُّكَ هُوَ عَلَىَّ هَيِّنٌ وَقَدْ خَلَقْتُكَ مِن قَبْلُ وَلَمْ تَكُ شَيْـًٔا,"Allah: &quot;Rabbin böyle buyurdu; Çünkü bu bana kolaydır, nitekim sen yokken daha önce seni yaratmıştım&quot; dedi."
19,10,19:10,قال رب اجعل لى ءاية ۚ قال ءايتك الا تكلم الناس ثلث ليال سويا,قَالَ رَبِّ ٱجْعَل لِّىٓ ءَايَةً ۚ قَالَ ءَايَتُكَ أَلَّا تُكَلِّمَ ٱلنَّاسَ ثَلَـٰثَ لَيَالٍ سَوِيًّا,"Zekeriya &quot;Rabbim! Öyleyse bana bir alamet ver&quot; dedi. Allah: &quot;Senin alametin, sağlam ve sıhhatli olduğun halde üç gün üç gece insanlarla konuşamamandır&quot; buyurdu."
20,1,20:1, طه, طه,"Ta, Ha."
20,2,20:2,ما انزلنا عليك القرءان لتشقى,مَآ أَنزَلْنَا عَلَيْكَ ٱلْقُرْءَانَ لِتَشْقَىٰٓ,"Kuran'ı sana, sıkıntıya düşeşin diye değil, ancak Allah'tan korkanlara bir öğüt ve yeri ve yüce gökleri yaratanın katından bir Kitap olarak indirdik."
20,3,20:3,الا تذكرة لمن يخشى,إِلَّا تَذْكِرَةً لِّمَن يَخْشَىٰ,"Kuran'ı sana, sıkıntıya düşeşin diye değil, ancak Allah'tan korkanlara bir öğüt ve yeri ve yüce gökleri yaratanın katından bir Kitap olarak indirdik."
20,4,20:4,تنزيلا ممن خلق الارض والسموت العلى,تَنزِيلًا مِّمَّنْ خَلَقَ ٱلْأَرْضَ وَٱلسَّمَـٰوَٰتِ ٱلْعُلَى,"Kuran'ı sana, sıkıntıya düşeşin diye değil, ancak Allah'tan korkanlara bir öğüt ve yeri ve yüce gökleri yaratanın katından bir Kitap olarak indirdik."
20,5,20:5,الرحمن على العرش استوى,ٱلرَّحْمَـٰنُ عَلَى ٱلْعَرْشِ ٱسْتَوَىٰ,Rahman arşa hükmetmektedir.
20,6,20:6,لهۥ ما فى السموت وما فى الارض وما بينهما وما تحت الثرى,لَهُۥ مَا فِى ٱلسَّمَـٰوَٰتِ وَمَا فِى ٱلْأَرْضِ وَمَا بَيْنَهُمَا وَمَا تَحْتَ ٱلثَّرَىٰ,"Göklerde ve yerde, her ikisi arasında ve toprağın altında bulunanlar O'nundur."
20,7,20:7,وان تجهر بالقول فانهۥ يعلم السر واخفى,وَإِن تَجْهَرْ بِٱلْقَوْلِ فَإِنَّهُۥ يَعْلَمُ ٱلسِّرَّ وَأَخْفَى,"Sen sözü istersen açığa vur, şüphesiz O gizliyi de, gizlinin gizlisini de bilir."
20,8,20:8,الله لا اله الا هو ۖ له الاسماء الحسنى,ٱللَّهُ لَآ إِلَـٰهَ إِلَّا هُوَ ۖ لَهُ ٱلْأَسْمَآءُ ٱلْحُسْنَىٰ,"Allah'tan başka tanrı yoktur, en güzel isimler O'nundur."
20,9,20:9,وهل اتىك حديث موسى,وَهَلْ أَتَىٰكَ حَدِيثُ مُوسَىٰٓ,Musa'nın başından geçen olay sana geldi mi?
20,10,20:10,اذ رءا نارا فقال لاهله امكثوا۟ انى ءانست نارا لعلى ءاتيكم منها بقبس او اجد على النار هدى,إِذْ رَءَا نَارًا فَقَالَ لِأَهْلِهِ ٱمْكُثُوٓا۟ إِنِّىٓ ءَانَسْتُ نَارًا لَّعَلِّىٓ ءَاتِيكُم مِّنْهَا بِقَبَسٍ أَوْ أَجِدُ عَلَى ٱلنَّارِ هُدًى,"O, bir ateş görmüştü de, ailesine: &quot;Durun, ben bir ateş gördüm, ya ondan size bir kor getirir, ya da ateşin yanında bir yol gösteren bulurum&quot; demişti."
21,1,21:1, اقترب للناس حسابهم وهم فى غفلة معرضون, ٱقْتَرَبَ لِلنَّاسِ حِسَابُهُمْ وَهُمْ فِى غَفْلَةٍ مُّعْرِضُونَ,"İnsanların hesap görme zamanı yaklaştı, fakat onlar hala habersiz, hakdan yüz çeviriyorlar."
21,2,21:2,ما ياتيهم من ذكر من ربهم محدث الا استمعوه وهم يلعبون,مَا يَأْتِيهِم مِّن ذِكْرٍ مِّن رَّبِّهِم مُّحْدَثٍ إِلَّا ٱسْتَمَعُوهُ وَهُمْ يَلْعَبُونَ,"Rablerinden kendilerine gelen her yeni ihtarı mutlaka, gönülleri gaflet içinde eğlenerek dinlerler. Zulmedenler, gizli toplantılarında: &quot;Bu zat, sizin gibi bir insandan başka bir şey midir? Siz, göz göre göre sihre mi uyarsınız?&quot; diye konuşurlar."
21,3,21:3,لاهية قلوبهم ۗ واسروا۟ النجوى الذين ظلموا۟ هل هذا الا بشر مثلكم ۖ افتاتون السحر وانتم تبصرون,لَاهِيَةً قُلُوبُهُمْ ۗ وَأَسَرُّوا۟ ٱلنَّجْوَى ٱلَّذِينَ ظَلَمُوا۟ هَلْ هَـٰذَآ إِلَّا بَشَرٌ مِّثْلُكُمْ ۖ أَفَتَأْتُونَ ٱلسِّحْرَ وَأَنتُمْ تُبْصِرُونَ,"Rablerinden kendilerine gelen her yeni ihtarı mutlaka, gönülleri gaflet içinde eğlenerek dinlerler. Zulmedenler, gizli toplantılarında: &quot;Bu zat, sizin gibi bir insandan başka bir şey midir? Siz, göz göre göre sihre mi uyarsınız?&quot; diye konuşurlar."
21,4,21:4,قال ربى يعلم القول فى السماء والارض ۖ وهو السميع العليم,قَالَ رَبِّى يَعْلَمُ ٱلْقَوْلَ فِى ٱلسَّمَآءِ وَٱلْأَرْضِ ۖ وَهُوَ ٱلسَّمِيعُ ٱلْعَلِيمُ,"Peygamber: &quot;Benim Rabbim gökte ve yerde söyleneni bilir. O, işitendir, bilendir&quot; dedi."
21,5,21:5,بل قالوا۟ اضغث احلمۭ بل افترىه بل هو شاعر فلياتنا باية كما ارسل الاولون,بَلْ قَالُوٓا۟ أَضْغَـٰثُ أَحْلَـٰمٍۭ بَلِ ٱفْتَرَىٰهُ بَلْ هُوَ شَاعِرٌ فَلْيَأْتِنَا بِـَٔايَةٍ كَمَآ أُرْسِلَ ٱلْأَوَّلُونَ,"Onlar: &quot;Hayır; bunlar karışık rüyalardır&quot;, &quot;Hayır; onu uydurmuştur&quot;, &quot;Hayır; o şairdir&quot;, &quot;Haydi önceki peygamberler gibi o da bize bir mucize getirsin&quot; dediler."
21,6,21:6,ما ءامنت قبلهم من قرية اهلكنها ۖ افهم يومنون,مَآ ءَامَنَتْ قَبْلَهُم مِّن قَرْيَةٍ أَهْلَكْنَـٰهَآ ۖ أَفَهُمْ يُؤْمِنُونَ,"Onlardan önce yoketmiş olduğumuz kasabalar halkı inanmadılar, bunlar mı inanacaklar?"
21,7,21:7,وما ارسلنا قبلك الا رجالا نوحى اليهم ۖ فسلوا۟ اهل الذكر ان كنتم لا تعلمون,وَمَآ أَرْسَلْنَا قَبْلَكَ إِلَّا رِجَالًا نُّوحِىٓ إِلَيْهِمْ ۖ فَسْـَٔلُوٓا۟ أَهْلَ ٱلذِّكْرِ إِن كُنتُمْ لَا تَعْلَمُونَ,"Senden önce de, kendilerine vahyettiğimiz adamlar gönderdik. Bilmiyorsanız kitablılara sorun."
21,8,21:8,وما جعلنهم جسدا لا ياكلون الطعام وما كانوا۟ خلدين,وَمَا جَعَلْنَـٰهُمْ جَسَدًا لَّا يَأْكُلُونَ ٱلطَّعَامَ وَمَا كَانُوا۟ خَـٰلِدِينَ,Biz onları yemek yemez birer ceset kılmadık ve onlar ölümsüz de değillerdi.
21,9,21:9,ثم صدقنهم الوعد فانجينهم ومن نشاء واهلكنا المسرفين,ثُمَّ صَدَقْنَـٰهُمُ ٱلْوَعْدَ فَأَنجَيْنَـٰهُمْ وَمَن نَّشَآءُ وَأَهْلَكْنَا ٱلْمُسْرِفِينَ,"Sonra Biz onlara verdiğimiz sözü yerine getirdik, kendilerini ve dilediklerimizi kurtardık; aşırı gidenleri ise yok ettik."
21,10,21:10,لقد انزلنا اليكم كتبا فيه ذكركم ۖ افلا تعقلون,لَقَدْ أَنزَلْنَآ إِلَيْكُمْ كِتَـٰبًا فِيهِ ذِكْرُكُمْ ۖ أَفَلَا تَعْقِلُونَ,"And olsun ki, size şerefiniz ve öğüt veren bir Kitap indirdik; akletmiyor musunuz?"
22,1,22:1, يايها الناس اتقوا۟ ربكم ۚ ان زلزلة الساعة شىء عظيم, يَـٰٓأَيُّهَا ٱلنَّاسُ ٱتَّقُوا۟ رَبَّكُمْ ۚ إِنَّ زَلْزَلَةَ ٱلسَّاعَةِ شَىْءٌ عَظِيمٌ,Ey insanlar! Rabbinizden sakının; doğrusu kıyamet gününün sarsıntısı büyük şeydir.
22,2,22:2,يوم ترونها تذهل كل مرضعة عما ارضعت وتضع كل ذات حمل حملها وترى الناس سكرى وما هم بسكرى ولكن عذاب الله شديد,يَوْمَ تَرَوْنَهَا تَذْهَلُ كُلُّ مُرْضِعَةٍ عَمَّآ أَرْضَعَتْ وَتَضَعُ كُلُّ ذَاتِ حَمْلٍ حَمْلَهَا وَتَرَى ٱلنَّاسَ سُكَـٰرَىٰ وَمَا هُم بِسُكَـٰرَىٰ وَلَـٰكِنَّ عَذَابَ ٱللَّهِ شَدِيدٌ,"Kıyameti gören her emzikli kadın emzirdiğini unutur, her hamile kadın çocuğunu düşürür. İnsanları sarhoş gibi görürsün oysa sarhoş değildirler, fakat bu sadece Allah'ın azabının çetin olmasındandır."
22,3,22:3,ومن الناس من يجدل فى الله بغير علم ويتبع كل شيطن مريد,وَمِنَ ٱلنَّاسِ مَن يُجَـٰدِلُ فِى ٱللَّهِ بِغَيْرِ عِلْمٍ وَيَتَّبِعُ كُلَّ شَيْطَـٰنٍ مَّرِيدٍ,Allah hakkında bilmeden taşıyan ve her azılı şeytana uyan insanlar vardır.
22,4,22:4,كتب عليه انهۥ من تولاه فانهۥ يضلهۥ ويهديه الى عذاب السعير,كُتِبَ عَلَيْهِ أَنَّهُۥ مَن تَوَلَّاهُ فَأَنَّهُۥ يُضِلُّهُۥ وَيَهْدِيهِ إِلَىٰ عَذَابِ ٱلسَّعِيرِ,Onun hakkında şöyle yazılmıştır: O kendisini dost edinen kimseyi saptırır ve alevli azaba götürür.
22,5,22:5,يايها الناس ان كنتم فى ريب من البعث فانا خلقنكم من تراب ثم من نطفة ثم من علقة ثم من مضغة مخلقة وغير مخلقة لنبين لكم ۚ ونقر فى الارحام ما نشاء الى اجل مسمى ثم نخرجكم طفلا ثم لتبلغوا۟ اشدكم ۖ ومنكم من يتوفى ومنكم من يرد الى ارذل العمر لكيلا يعلم منۢ بعد علم شيا ۚ وترى الارض هامدة فاذا انزلنا عليها الماء اهتزت وربت وانۢبتت من كل زوجۭ بهيج,يَـٰٓأَيُّهَا ٱلنَّاسُ إِن كُنتُمْ فِى رَيْبٍ مِّنَ ٱلْبَعْثِ فَإِنَّا خَلَقْنَـٰكُم مِّن تُرَابٍ ثُمَّ مِن نُّطْفَةٍ ثُمَّ مِنْ عَلَقَةٍ ثُمَّ مِن مُّضْغَةٍ مُّخَلَّقَةٍ وَغَيْرِ مُخَلَّقَةٍ لِّنُبَيِّنَ لَكُمْ ۚ وَنُقِرُّ فِى ٱلْأَرْحَامِ مَا نَشَآءُ إِلَىٰٓ أَجَلٍ مُّسَمًّى ثُمَّ نُخْرِجُكُمْ طِفْلًا ثُمَّ لِتَبْلُغُوٓا۟ أَشُدَّكُمْ ۖ وَمِنكُم مَّن يُتَوَفَّىٰ وَمِنكُم مَّن يُرَدُّ إِلَىٰٓ أَرْذَلِ ٱلْعُمُرِ لِكَيْلَا يَعْلَمَ مِنۢ بَعْدِ عِلْمٍ شَيْـًٔا ۚ وَتَرَى ٱلْأَرْضَ هَامِدَةً فَإِذَآ أَنزَلْنَا عَلَيْهَا ٱلْمَآءَ ٱهْتَزَّتْ وَرَبَتْ وَأَنۢبَتَتْ مِن كُلِّ زَوْجٍۭ بَهِيجٍ,"Ey insanlar! Öldükten sonra tekrar dirilmekten şüphede iseniz bilin ki, ne olduğunuzu size açıklamak için, Biz sizi topraktan sonra nutfeden, sonra pıhtılaşmış kandan, sonra da yapısı belli belirsiz bir çiğnem etten yaratmışızdır. Dilediğimizi belli bir süreye kadar rahimlerde tutarız; sonra sizi çocuk olarak çıkartırız, böylece yetişip erginlik çağına varırsınız. Kiminiz öldürülür, kiminiz de ömrünün en fena zamanına ulaştırılır ki, bilirken birşey bilmez olur. Yeryüzünü görürsün ki kupkurudur; fakat Biz ona su indirdiğimiz zaman harekete geçer, kabarır, her güzel bitkiden çift çift yetiştirir."
22,6,22:6,ذلك بان الله هو الحق وانهۥ يحى الموتى وانهۥ على كل شىء قدير,ذَٰلِكَ بِأَنَّ ٱللَّهَ هُوَ ٱلْحَقُّ وَأَنَّهُۥ يُحْىِ ٱلْمَوْتَىٰ وَأَنَّهُۥ عَلَىٰ كُلِّ شَىْءٍ قَدِيرٌ,"Bunlar, yalnız Allah'ın gerçek olduğunu, ölüleri dirilttiğini, gücünün herşeye yettiğini, şüphe götürmeyen kıyamet saatinin geleceğini, Allah'ın kabirlerde olanı dirilteceğini gösterir."
22,7,22:7,وان الساعة ءاتية لا ريب فيها وان الله يبعث من فى القبور,وَأَنَّ ٱلسَّاعَةَ ءَاتِيَةٌ لَّا رَيْبَ فِيهَا وَأَنَّ ٱللَّهَ يَبْعَثُ مَن فِى ٱلْقُبُورِ,"Bunlar, yalnız Allah'ın gerçek olduğunu, ölüleri dirilttiğini, gücünün herşeye yettiğini, şüphe götürmeyen kıyamet saatinin geleceğini, Allah'ın kabirlerde olanı dirilteceğini gösterir."
22,8,22:8,ومن الناس من يجدل فى الله بغير علم ولا هدى ولا كتب منير,وَمِنَ ٱلنَّاسِ مَن يُجَـٰدِلُ فِى ٱللَّهِ بِغَيْرِ عِلْمٍ وَلَا هُدًى وَلَا كِتَـٰبٍ مُّنِيرٍ,"Bilmeden, doğruya götüren bir rehberi olmadan, aydınlatıcı bir kitabı da bulunmadan Allah yolundan saptırmak için büyüklük taslayarak Allah hakkında tartışan insan vardır. Dünyada rezillik onadır; ona kıyamet günü yakıcı azabı tattırırız."
22,9,22:9,ثانى عطفهۦ ليضل عن سبيل الله ۖ لهۥ فى الدنيا خزى ۖ ونذيقهۥ يوم القيمة عذاب الحريق,ثَانِىَ عِطْفِهِۦ لِيُضِلَّ عَن سَبِيلِ ٱللَّهِ ۖ لَهُۥ فِى ٱلدُّنْيَا خِزْىٌ ۖ وَنُذِيقُهُۥ يَوْمَ ٱلْقِيَـٰمَةِ عَذَابَ ٱلْحَرِيقِ,"Bilmeden, doğruya götüren bir rehberi olmadan, aydınlatıcı bir kitabı da bulunmadan Allah yolundan saptırmak için büyüklük taslayarak Allah hakkında tartışan insan vardır. Dünyada rezillik onadır; ona kıyamet günü yakıcı azabı tattırırız."
22,10,22:10,ذلك بما قدمت يداك وان الله ليس بظلم للعبيد,ذَٰلِكَ بِمَا قَدَّمَتْ يَدَاكَ وَأَنَّ ٱللَّهَ لَيْسَ بِظَلَّـٰمٍ لِّلْعَبِيدِ,"Ona: &quot;Bunlar senin yaptıklarından ötürüdür&quot; denir, yoksa Allah, kullarına karşı hiç de zalim değildir."
23,1,23:1, قد افلح المومنون, قَدْ أَفْلَحَ ٱلْمُؤْمِنُونَ,Müminler saadete ermişlerdir.
23,2,23:2,الذين هم فى صلاتهم خشعون,ٱلَّذِينَ هُمْ فِى صَلَاتِهِمْ خَـٰشِعُونَ,Onlar namazda huşu içindedirler.
23,3,23:3,والذين هم عن اللغو معرضون,وَٱلَّذِينَ هُمْ عَنِ ٱللَّغْوِ مُعْرِضُونَ,Onlar boş şeylerden yüz çevirirler.
23,4,23:4,والذين هم للزكوة فعلون,وَٱلَّذِينَ هُمْ لِلزَّكَوٰةِ فَـٰعِلُونَ,Onlar zekatlarını verirler.
23,5,23:5,والذين هم لفروجهم حفظون,وَٱلَّذِينَ هُمْ لِفُرُوجِهِمْ حَـٰفِظُونَ,"Onlar, eşleri ve cariyeleri dışında, mahrem yerlerini herkesten korurlar. Doğrusu bunlar yerilemezler."
23,6,23:6,الا على ازوجهم او ما ملكت ايمنهم فانهم غير ملومين,إِلَّا عَلَىٰٓ أَزْوَٰجِهِمْ أَوْ مَا مَلَكَتْ أَيْمَـٰنُهُمْ فَإِنَّهُمْ غَيْرُ مَلُومِينَ,"Onlar, eşleri ve cariyeleri dışında, mahrem yerlerini herkesten korurlar. Doğrusu bunlar yerilemezler."
23,7,23:7,فمن ابتغى وراء ذلك فاو۟ليك هم العادون,فَمَنِ ٱبْتَغَىٰ وَرَآءَ ذَٰلِكَ فَأُو۟لَـٰٓئِكَ هُمُ ٱلْعَادُونَ,"Bu sınırları aşmak isteyenler, işte bunlar aşırı gidenlerdir."
23,8,23:8,والذين هم لامنتهم وعهدهم رعون,وَٱلَّذِينَ هُمْ لِأَمَـٰنَـٰتِهِمْ وَعَهْدِهِمْ رَٰعُونَ,Onlar emanetlerini ve sözlerini yerine getirirler.
23,9,23:9,والذين هم على صلوتهم يحافظون,وَٱلَّذِينَ هُمْ عَلَىٰ صَلَوَٰتِهِمْ يُحَافِظُونَ,Namazlarına riayet ederler.
23,10,23:10,او۟ليك هم الورثون,أُو۟لَـٰٓئِكَ هُمُ ٱلْوَٰرِثُونَ,"İşte onlar, temelli kalacakları Firdevs cennetine varis olanlardır."
